date,username,to,replies,retweets,favorites,text,geo,mentions,hashtags,id,permalink
5/29/20,GeophysicsPanda,ChallenWStewart,1,0,2,"Hahaha -yup.All historians, scientist and experts are all wrong but your youtube videos are reality. You're like, really,really smart. Probably one of the smartest on this big flat earth, huh? You acheived one thing - you made a STRONG case for education reform in this country.",,,,1.27E+18,https://twitter.com/GeophysicsPanda/status/1266404475327197190
5/29/20,Jonathan_Ufi,,0,0,0,"Obviously real reform and a large defunding of police is needed. But this revolution cannot end without redistribution of wealth, health care as a right, and equitable education reform and funding.",,,,1.27E+18,https://twitter.com/Jonathan_Ufi/status/1266403956223119361
5/29/20,sahaniKIND,,1,1,1,"We are living in a world where you believe what you see, but unfortunately what you see is written by those who see what they believe. India need #Educationreform @ARanganathan72 Jai Hind sir. ",,@ARanganathan72,#Educationreform,1.27E+18,https://twitter.com/sahaniKIND/status/1266399176797024256
5/29/20,jbblawmd,jrgoodwyn,1,0,0,I’d probably put education reform first.,,,,1.27E+18,https://twitter.com/jbblawmd/status/1266398918574817282
5/29/20,SteffiSingh_,GarethPresch,0,2,4,Very exciting times Gareth look forward to furthering the conversation around education reform and equal opportunities for women in STEM.,,,,1.27E+18,https://twitter.com/SteffiSingh_/status/1266395238341500930
5/29/20,IvanVegner,mechanicalmonk1,0,0,2,"COVID seems to be wreaking havoc on the college industry. Taking on huge debt for a degree and no job has never seemed like a worse idea. Waiting to see if this will prompt education reform, or if the fed will just bail out colleges and tell the students to go fuck themselves",,,,1.27E+18,https://twitter.com/IvanVegner/status/1266389337593217025
5/29/20,Esposito2R,edutopia,0,0,0,"Great points, shouldn’t that be the same online and in school? #educationreform #remoteworking #distancelearning @FixingEducation means @MindShiftKQED #edtech",,@FixingEducation @MindShiftKQED,#educationreform #remoteworking #distancelearning #edtech,1.27E+18,https://twitter.com/Esposito2R/status/1266379145988079616
5/29/20,commonsense571,AriCohn,0,0,0,"I am a teacher, and I could not agree more. The VERY apparent lack of understanding of the constitution in general should be the focus of national education reform in post Trump times. ",,,,1.27E+18,https://twitter.com/commonsense571/status/1266370287227990018
5/29/20,Adalsingh11,vivekagnihotri,0,0,0,True Education Reform only can save India.,,,,1.27E+18,https://twitter.com/Adalsingh11/status/1266370173667143681
5/29/20,Pairsonnalites,,0,0,0,Fighting Stigma : How best can we shape education reform to improve employment outcomes in a changing world?: © 2020 British Council. The United Kingdom's international organisation for cultural relations and educational opportunities. A registered… http://dlvr.it/RXbTkz,,,,1.27E+18,https://twitter.com/Pairsonnalites/status/1266367073397030912
5/29/20,RoseGoldJammin,asj519,0,0,1,Shit like this pisses me off cause where is this energy for reforming impoverished communities in rural and urban areas across the nation and education reform? If we can do this we can do anything ,,,,1.27E+18,https://twitter.com/RoseGoldJammin/status/1266364560690249728
5/29/20,indigo_rex,KingUhDeNorth,0,0,1,"Education reform, Marijuana industry or Cultural and Creative Industries getting the recognition they deserve",,,,1.27E+18,https://twitter.com/indigo_rex/status/1266357948953001985
5/29/20,Kate_Howell_Phd,,0,1,3,"Nice work, @GoodRyanM @JUAurban special issue Unequal Schools and Communities: A Critical Examination of Neoliberal Education Reform: ",,@GoodRyanM @JUAurban,,1.27E+18,https://twitter.com/Kate_Howell_Phd/status/1266346690187059200
5/29/20,AshokSom,,0,0,1,Interesting read: #Campus #education as a #luxury good — the marriage of tech + accredited degree. #educationreform #globalmba,,,#Campus #education #luxury #educationreform #globalmba,1.27E+18,https://twitter.com/AshokSom/status/1266344122228580354
5/29/20,ConfettisG,eiz_real,1,0,0,"youre right it isnt just blacks, but i see them stealing shit from target and escalating the situation. what you're all doing is burning your jobs. im not using crime statistics to justify this mans death im using it to justify there needs to be some education reform",,,,1.27E+18,https://twitter.com/ConfettisG/status/1266342664108216320
5/29/20,blackrevolverOA,DefNotYourMate,1,1,3,There might be no effective police reform without Education reform.,,,,1.27E+18,https://twitter.com/blackrevolverOA/status/1266335483463905280
5/29/20,billsplacehere,charliekirk11,0,0,0,"EDUCATION REFORM NEEDED MARXIST DEMOCRAT PARTY OPERATIVES PROPAGANDISTS SCAM ARTISTS INDOCRINATION PART OF TEACHING, CRIMINAL CARTEL OF CORRUPT ",,,,1.27E+18,https://twitter.com/billsplacehere/status/1266333084095524867
5/29/20,JhutBolo,JhutBolo,1,0,0,"Spend more on public education–>More and quality(& affordable) public institutes–>Everybody has a chance to quality education–&gt;Reform the education system to teach values kindness, respect in relationships &amp; regard for under privileged in addition to giving them 2/n",,,,1.27E+18,https://twitter.com/JhutBolo/status/1266323376043372544
5/29/20,YogaEU,,1,0,0,Yoga Teacher Training in Prague http://www.yoga-federation.eu #bankingindustry #educationpolicy #educationreform #highereducation #hotelsandmotels #mobilemarketing #publicrelations #digitalmarketing #entrepreneurship #healthcarereform #industrialdesign,,,#bankingindustry #educationpolicy #educationreform #highereducation #hotelsandmotels #mobilemarketing #publicrelations #digitalmarketing #entrepreneurship #healthcarereform #industrialdesign,1.27E+18,https://twitter.com/YogaEU/status/1266320263664279552
5/29/20,dani__burr,lakotalaw,1,3,23,They NEED to teach colonialism in secondary schools AND the effects it has on other populations/societies that had been “white-washed” from the perspective of those people affected. And that’s on education reform in America.,,,,1.27E+18,https://twitter.com/dani__burr/status/1266299368962813952
5/29/20,ErnestNkamta,,0,0,0,How best can we shape education reform to improve employment outcomes in a changing world? ,,,,1.27E+18,https://twitter.com/ErnestNkamta/status/1266279660406497280
5/29/20,pradeep_cie,,1,13,10,"@ArvindKejriwal @msisodia @LtGovDelhi @ManojTiwariMP @AmitShah @ndtvindia @socialjurist delhi guest teachers doing well in delhi education reform. in lockdown period they r taking online classes, happiness activities,daily attendance just like permanent. Then why without pay.???",,@ArvindKejriwal @msisodia @LtGovDelhi @ManojTiwariMP @AmitShah @ndtvindia @socialjurist,,1.27E+18,https://twitter.com/pradeep_cie/status/1266276520638607363
5/29/20,tuesdayagainnp,milksteak_45,0,0,3,"Change happens thru continuous education &amp; reform, and exposing these corporations is an important part of reforming these systems. Revolutions are built on sentiments like these!!! #neversaynever",,,#neversaynever,1.27E+18,https://twitter.com/tuesdayagainnp/status/1266273913002094592
5/29/20,CarlbergElena,shoulders2968,1,0,0,"Distraction? They’re fighting for education reform, they’re fighting for a strong economy, they’re fighting against those who wish to oppress us. They’re fighting against millions of babies being aborted. I could go on and on. They’re FAR from a distraction, they’re the answer",,,,1.27E+18,https://twitter.com/CarlbergElena/status/1266269048871858177
5/29/20,jackdecmich,SushantNMehta,0,0,0,"Pass.Pass.Atleast do some credible journalism There are important things to discuss like education reform,healthcare ,environmental reform "" Celebs"" dont care. We need people like Leo Caprio in India This is like Trump golfing while the american toll hit 100,000. @TheDeshBhakt",,@TheDeshBhakt,,1.27E+18,https://twitter.com/jackdecmich/status/1266267818967699456
5/29/20,FICILatvia,,0,1,3,"Zlata Elksiņa Zaščirinska: Higher education reform needs to go ahead without hesitation. Regarding human resources, the State Employment Agency should not only manage unemployment but also focus on employed people upskilling to ensure most have necessary skills for job market",,,,1.27E+18,https://twitter.com/FICILatvia/status/1266264443672948742
5/29/20,CalebAdeagbo,cchukudebelu,3,0,2,Apapa-Lagos Ibadan expressway Lagos Ibadan railway 2nd Niger bridge Establishment of colleges of education Agric reform Education reform Health reform Security reform,,,,1.27E+18,https://twitter.com/CalebAdeagbo/status/1266254332363603972
5/29/20,FICILatvia,,0,6,5,"PM Karins: This is not a belt tightening crisis, we are investing into the economy. However our national debt will go up. Regarding substance: moving through two big reforms: territorial reform and higher education reform",,,,1.27E+18,https://twitter.com/FICILatvia/status/1266251495286009858
5/29/20,iholytrojan,,0,0,2,I can’t wait to see what our education reform looks like after all of this. feeling: excited for the future ,,,,1.27E+18,https://twitter.com/iholytrojan/status/1266245332611915776
5/29/20,implementEIC,,0,0,1,What are the key initiatives and challenges for developing an evidence-based education reform in Europe? Perspectives by Marta Pellegrini and Giuliano Vivanet: https://bit.ly/36HgdCf #ebpm #impsci #policyreform,,,#ebpm #impsci #policyreform,1.27E+18,https://twitter.com/implementEIC/status/1266241752081391618
5/29/20,Pizzazz_Books,,0,0,0,"An entertaining novel that exposes the seamy underside of education reform. ★MINNISSIPPI★ ""@jmalmonor http://wp.me/P5rIsN-3C2 #education #ASMSG ✎via Pizzazz Book Promotions http://wp.me/P5rIsN-Ft",,@jmalmonor,#education #ASMSG,1.27E+18,https://twitter.com/Pizzazz_Books/status/1266241447503642625
5/29/20,AntonioMabs,realDonaldTrump,0,0,0,"Is it hard for you to sleep at night? Reform the police, reform education, reform America. You preach a lot about MAGA yet we can all see how the US just keeps getting worse. You care more about the looting than the lives of your fellow americans. Shameful Donald, shameful.",,,,1.27E+18,https://twitter.com/AntonioMabs/status/1266237909910253568
5/29/20,EDavis704,Janeese4DC,0,0,1,I’ve tired of the Democrats for Education Reform (DFER) trying to use their mega bucks to buy influence and vot scheme privatize our public institutions...especially our matter of right public schools. New Orleans is the best example of what we never want in DC! #STAYWOKE DC!!!!,,,#STAYWOKE,1.27E+18,https://twitter.com/EDavis704/status/1266229648456912896
5/29/20,titobryce,titobryce,2,0,0,and what I mean reform is this: -abolishing warrior policing -police education reform -strengthening of police accountability laws -abolishing police unions that prevent through and just investigations in situations like these -and the stripping of credentials of officers,,,,1.27E+18,https://twitter.com/titobryce/status/1266224290996686849
5/29/20,BenHarris_1,BenHarris_1,0,0,0,"Hi Catharine, do you know why an organization devoted to “education reform” mailing out things like this? ",,,,1.27E+18,https://twitter.com/BenHarris_1/status/1266217714638561280
5/29/20,ShadowKymera,,0,0,1,"One last tweet(s?) for this Considering the whole state of the US, I'm pretty sure that, until there's a rebuilding of the country, no way an education reform will be a priority But we can do that here in Portugal, even with our major flaws We can and need an education reform",,,,1.27E+18,https://twitter.com/ShadowKymera/status/1266217246126415872
5/29/20,StanleyCupOT,,0,1,0,The most powerful politician in the United States is and has been Bill Gates. #commoncore #vaccine #educationreform #involvedineverything #pandemic,,,#commoncore #vaccine #educationreform #involvedineverything #pandemic,1.27E+18,https://twitter.com/StanleyCupOT/status/1266213787499102214
5/29/20,chauhan12345671,AmiSri,0,0,1,"Give them computer, education, scholarship... Anything. But this is how they intoxicate and indoctrinate their kids with Hindu-hate Funds for promotion of Urdu language #educationreform #hinduphobia_in_India @narendramodi @AmitShah @amitmalviya @myogiadityanath @DrRPNishank",,@narendramodi @AmitShah @amitmalviya @myogiadityanath @DrRPNishank,#educationreform #hinduphobia_in_India,1.27E+18,https://twitter.com/chauhan12345671/status/1266213509861216262
5/29/20,robertoblake,WisdomOfDan,0,0,4,"My stance is exactly that we prioritize education reform and focus on maximizing individual potential, financial literacy, practical skills, trades, and business development, as well as STEM and STEAM.",,,,1.27E+18,https://twitter.com/robertoblake/status/1266211016838438912
5/29/20,WrightWy2Travel,realDonaldTrump,0,0,0,"Why would it be an end to the Republican Party? Job numbers, healthcare, great federal judges, tax cuts, funded prison reform, funded education reform!",,,,1.27E+18,https://twitter.com/WrightWy2Travel/status/1266210570145054722
5/29/20,ghanshyamgt,,0,0,4,सरकारी स्कुलका लागि नयाँ नयाँ भवन बन्ने क्रम जारी छ तर हामी धेरैले अधिकतम शुल्क तिरेर भाडामा लिई साघुरा ठाँउमा सञ्चालित निजी स्कूलमा आफ्ना बालबच्चा पठाउछौ । निजी स्कूलले पनि आम्दानीको ठूलो हिस्सा भाडा तिर्नै खर्च गर्छन। समस्याको जरो कहाँ छ कुन्नि ? #EducationReform #RentSeeking,,,#EducationReform #RentSeeking,1.27E+18,https://twitter.com/ghanshyamgt/status/1266210210902732802
5/29/20,paulbharing,,0,0,0,Education reform bill in Mexico state of Nuevo Leon will “foster a respect for life from conception to natural death” - NRL News Today: https://www.nationalrighttolifenews.org/2020/05/education-reform-bill-in-mexico-state-of-nuevo-leon-will-foster-a-respect-for-life-from-conception-to-natural-death/#.XtB_mWG7Moc.twitter via @nrlc,,@nrlc,,1.27E+18,https://twitter.com/paulbharing/status/1266208433784717313
5/29/20,HerkKerk,RealCandaceO,0,0,1,"The bigger question is, why do Americans fall for this shit? We need some serious education reform. Our children are taught by walking Democrat Zombies!",,,,1.27E+18,https://twitter.com/HerkKerk/status/1266200229818359808
5/29/20,DashingMax,HouseJudiciary,0,1,4,Germany also had a history of violence against ethnic minority but they overcame it thru better education. People aren't born racists. They should be taught history and humanity. Education Reform will last longer than relying on courts to solve the racial violence problem.,,,,1.27E+18,https://twitter.com/DashingMax/status/1266188779536232449
5/29/20,FoxyNormiexx,,0,0,0,"David Lamar Williams Jr. - Gov For Delaware https://www.davidlamarwilliamsjrforgovernorofde.com/ @david_delaware supports education reform, housing assistance, ensuring all Delaware citizens a liveable wage, improving infrastructure, providing everyone healthcare options, &amp; addressing climate change. ",,@david_delaware,,1.27E+18,https://twitter.com/FoxyNormiexx/status/1266186684468801536
5/29/20,liora_,,1,0,3,Twitter's been such a great way to hear directly from the source about current events. Watching things unfold through @balajis has given me some new thoughts on - Bad/misinterpreted studies - Gatekeeping - Citizen journalism - Education reform 1/ ,,@balajis,,1.27E+18,https://twitter.com/liora_/status/1266177363961720834
5/29/20,KevinKGC,,0,0,1,education reform to teach generations we ain’t letting bullshit slide,,,,1.27E+18,https://twitter.com/KevinKGC/status/1266169316510031872
5/29/20,rdlln,KrisNordstrom,2,6,55,Nice! @DeAngelisCorey is a champion for education reform who really knows his stuff. I’ve spent my entire adult life working for government schools &amp; know first hand just how badly #schoolchoice is needed,,@DeAngelisCorey,#schoolchoice,1.27E+18,https://twitter.com/rdlln/status/1266165450741776385
5/28/20,CGWalker30,OctoberFerguson,2,1,20,Why isn’t education reform a major issue this election?,,,,1.27E+18,https://twitter.com/CGWalker30/status/1266156836090044416
5/28/20,WorkLifePurpose,educationreform,0,0,0,You are so sweet! Thank you for your kind words. ,,,,1.27E+18,https://twitter.com/WorkLifePurpose/status/1266152926441082881
5/28/20,iLevelSports,,0,0,0,"#Chinese students in the United States from 19th Century to 21st Century – Educ 300: Education Reform, Past and Present https://commons.trincoll.edu/edreform/2018/05/chinese-students-in-the-united-states-from-19th-century-to-21st-century/",,,#Chinese,1.27E+18,https://twitter.com/iLevelSports/status/1266152440207831040
5/28/20,RoYurBoat,itssarahwells,1,0,0,"Ryan Young, mayor of Saint Annes. Third generation JA professor Animals and Nature in cinema and society. Oddly enough, the class and him are the reason im trying to shoot a documentary on education reform and community outreach!",,,,1.27E+18,https://twitter.com/RoYurBoat/status/1266151349248557059
5/28/20,iLevelSports,,0,0,0,"#Chinese students in the United States from 19th Century to 21st Century – Educ 300: Education Reform, Past and Present. https://commons.trincoll.edu/edreform/2018/05/chinese-students-in-the-united-states-from-19th-century-to-21st-century/",,,#Chinese,1.27E+18,https://twitter.com/iLevelSports/status/1266149605047066627
5/28/20,hammerdgramma,gtconway3d,0,0,0,Only if we don't enact real education reform.,,,,1.27E+18,https://twitter.com/hammerdgramma/status/1266146995326070784
5/28/20,dylansewell0219,jakeeeee_rogers,0,0,0,"The irony of the poor torching affordable housing &robbing a store which probably provides work to their own friends or relatives is baffling, and it shows that in addition to police reform we should explore possible avenues of education reform. Talk about shooting your own foot.",,,,1.27E+18,https://twitter.com/dylansewell0219/status/1266146578168938499
5/28/20,kammitama,,0,0,0,Omg it's SO good! My fwend is talking about primary schools struggling because teachers only ever used blackboards and dusters before Covid and about the need for education reform.,,,,1.27E+18,https://twitter.com/kammitama/status/1266144000588812293
5/28/20,CivicExperts,,0,1,0,"""I don't care about politics. I probably would care if we had better government classes and more involvement."" 12th grade, Fairfax HS, Fairfax VA #CivicsForUs #EducationReform #studentvoice",,,#CivicsForUs #EducationReform #studentvoice,1.27E+18,https://twitter.com/CivicExperts/status/1266127109216321538
5/28/20,VincentSylvain,,0,0,0,Education Reform Now Extends Deadline for Leaders of Color Political Training Opportunity... https://conta.cc/2XSWknV,,,,1.27E+18,https://twitter.com/VincentSylvain/status/1266125737108672512
5/28/20,timmyshallowmay,alexsimoneex,0,0,1,"speaking of education, ya know the ONLY WAY to prevent this shit in other generations is education reform right? just wanted to let ya know. ",,,,1.27E+18,https://twitter.com/timmyshallowmay/status/1266121341649862658
5/28/20,myskay_,MikeRiley30,1,0,0,So you can’t proofread but you can judge people’s critically thought out correlations. And what was your point? That you’re an advocate for education reform? Or just felt like insulting people?,,,,1.27E+18,https://twitter.com/myskay_/status/1266110257522237440
5/28/20,Lennymcallister,DrChrisMetzler,0,0,4,"Same here, because we understand that there are issues that we DO agree upon. e.g., big ups to @rolandsmartin &amp; @DrStevePerry for advancing education reform in #Pennsylvania here with me last year: https://www.the74million.org/is-school-choice-the-black-choice-photos-video-and-reactions-from-philadelphia-education-town-hall/",,@rolandsmartin @DrStevePerry,#Pennsylvania,1.27E+18,https://twitter.com/Lennymcallister/status/1266104192722243586
5/28/20,supernovasoph,,1,0,1,Deborah M Keisch - U.S. Education Reform and the Maintenance of White Supremacy through Structural Violence,,,,1.27E+18,https://twitter.com/supernovasoph/status/1266099397818908672
5/28/20,RoYurBoat,,0,0,0,"now that im becoming more and more politically invested, its dangerous for me to tweet against POC vs White bc there's so much more to that very tip of the iceberg. I hope with education reform and community outreach that we strive a new generation of giving help and asking it.",,,,1.27E+18,https://twitter.com/RoYurBoat/status/1266096319543889920
5/28/20,getmorejohnson,franklinnb,1,0,1,"I’m as big a fan as there is, and I’m gonna 100% agree with you on this. Man’s worth WAY too much for us to play economic games the way we did. Had we reacted as quickly to education reform, road project management, etc, as we did this, we wouldn’t have 1/2 those problems",,,,1.27E+18,https://twitter.com/getmorejohnson/status/1266094954704748551
5/28/20,LeeMac711,liyahmua,1,0,0,You are avoiding the question. Rioting does not get you your answers. I'm trying to help by stating that this is why we need to change those in power. Transparency. Education. Reform. We need to put in place people who will make change.,,,,1.27E+18,https://twitter.com/LeeMac711/status/1266083953124966403
5/28/20,CityNewsMTL,,0,5,5,#NEW Quebec’s English School Boards Association is taking the province’s education reform to court. https://www.facebook.com/CityNewsMTL/photos/pb.423596921055456.-2207520000../3068316163250172/?type=3&amp;theater (photo credit: CP/ Jacques Boissinot),,,#NEW,1.27E+18,https://twitter.com/CityNewsMTL/status/1266082171925790721
5/28/20,AdvocateWriter,MarkDice,0,0,2,Burning down the city where you live is proof that we need education reform now. ,,,,1.27E+18,https://twitter.com/AdvocateWriter/status/1266078821897441280
5/28/20,demarkus365,,0,0,0,Yall congress responded to me this morning. They're going to allow me to continue drafting the Free Higher Education Reform @MajorityAce @mikegw76 @ELGARCIAS1 @DaKMartian5,,@MajorityAce @mikegw76 @ELGARCIAS1 @DaKMartian5,,1.27E+18,https://twitter.com/demarkus365/status/1266074834389413889
5/28/20,bootsie5,jimmy_dore,1,8,23,Cuomo is a power hungry ghoul that cut Medicaid in the middle of a pandemic to settle a political score against progressives & tried to cancel the NY primary. Additionally he’s taking over the NYC public school system w/ Bill Gates who already failed at public education reform.,,,,1.27E+18,https://twitter.com/bootsie5/status/1266065200760991747
5/28/20,PROD_SG,2nays,0,0,0,Most of the money goes to education reform. Poor &amp; homeless people are a huge percentage of people buying lottery tickets thinking they gonna get lucky. If people want to willingly give their money away to the government for them to reinvest in positive things im cool with that.,,,,1.27E+18,https://twitter.com/PROD_SG/status/1266057472319594496
5/28/20,educationreform,rolandsmartin,0,0,0,When will her cooning end? The Black Delegation has met and have determined that she has been traded. #BlackLivesMatter #GeorgeFloyd #thursdaymorning #minneapolisriots,,,#BlackLivesMatter #BlackLivesMatter #GeorgeFloyd #thursdaymorning #minneapolisriots,1.27E+18,https://twitter.com/educationreform/status/1266056374397603843
5/28/20,ci3342_mchu,Bali_Maha,0,2,6,"If you’re passionate about education reform during/after trauma (b/c this pandemic IS trauma to children), please read! ",,,,1.27E+18,https://twitter.com/ci3342_mchu/status/1266055029334605824
5/28/20,N8faflick,apluscolorado,0,0,6,COVID-19 has presented unprecedented challenges for the education ecosystem. I'm optimistic we're able to move forward in education reform post-covid in order to drive progress for vulnerable students and prevent the widening of existing gaps within the system. #EdColo,,,#EdColo,1.27E+18,https://twitter.com/N8faflick/status/1266054178549362694
5/28/20,RedKingsRace_,,0,0,5,If COVID-19 showed us anything it’s that we need serious education reform,,,,1.27E+18,https://twitter.com/RedKingsRace_/status/1266050239691186177
5/28/20,goncalves_guy,PassTheSalty,0,0,1,"How can we live in this century (YES, 21st CENTURY) and still witness cases like this? Is Dangerous to be an american in USA #EducationReform #MentalHealth #RegisterToVote #VoteBlueToSaveAmerica2020 @chezguyg",,@chezguyg,#EducationReform #MentalHealth #RegisterToVote #VoteBlueToSaveAmerica2020,1.27E+18,https://twitter.com/goncalves_guy/status/1266042283557826564
5/28/20,March_for_Life,,1,21,72,"Nuevo Leon, Mexico has passed an education reform bill to foster a deeper respect for life in students. “It’s important for the state to protect life, but it is also essential that it form citizens who respect and care for life.” ",,,,1.27E+18,https://twitter.com/March_for_Life/status/1266040792440885248
5/28/20,CollegeSpring,,0,0,0,Will eliminating the #SAT improve equity? Prateek Dutta at Democrats for Education Reform--Colorado dives in: https://www.the74million.org/?p=555845 via @The74 #highered #collegeadmissions,,@The74,#SAT #highered #collegeadmissions,1.27E+18,https://twitter.com/CollegeSpring/status/1266039359246970881
5/28/20,ScottGoldstein,mitchryals,0,1,5,"“Democrats for Education Reform DC is making a lot of noise about almost anything. Except education.” If DFER_DC &amp; @ramintaheri thought #Ward4 agreed with Brandon Todd on education, they’d be sending mailers about education. They know he’s out of step w/ Ward 4. Vote @Janeese4DC",,@ramintaheri @Janeese4DC,#Ward4,1.27E+18,https://twitter.com/ScottGoldstein/status/1266037369502826496
