date,username,to,replies,retweets,favorites,text,geo,mentions,hashtags,id,permalink
5/30/20,luismen1991,TDL4VT,0,0,2,"Yes terrible. Why do they get treated like this? Well the fact that the media stoked up stereotypes and the fact that 50% of violent crimes are committed by them is also something to factor in. How do you address this though? Well, job creation and education reform. All connected",,,,1.27E+18,https://twitter.com/luismen1991/status/1266757281217228800
5/30/20,EgalitarianHr,WildGoo60453753,1,0,0,We lack skills in this country but that is a discussion on the premium of education. We pay a lot in tuition but are we being skilled or educated? Corporations want skills not educated. Education reform is needed. We are educated in US but not skilled ...my thesis was on this.,,,,1.27E+18,https://twitter.com/EgalitarianHr/status/1266746523867664384
5/30/20,fedward,,1,0,0,"Who are ""Democrats for Education Reform DC"" and why are they sending mail that implies Trump supporters will vote in the Democratic primary? ",,,,1.27E+18,https://twitter.com/fedward/status/1266746393257017345
5/30/20,OurRevolution,,1,9,20,That's right. We need education reform that puts public schools first NOW. #PoliticalRevolution #OrganizeToWin @OurRevTexas,,@OurRevTexas,#PoliticalRevolution #OrganizeToWin,1.27E+18,https://twitter.com/OurRevolution/status/1266746189136846848
5/30/20,pamelaadlon,ava,5,14,167,Prison reform. Education reform. Reparations. @aclu is going in. What will you do? @buyblackmovemnt @oneunited @AfroTech @webuyblackcom,,@ACLU @buyblackmovemnt @oneunited @AfroTech @webuyblackcom,,1.27E+18,https://twitter.com/pamelaadlon/status/1266745674428628993
5/30/20,ahartley98,,0,0,0,A laundry list of education reform groups claiming to represent parents. ,,,,1.27E+18,https://twitter.com/ahartley98/status/1266742783701913600
5/30/20,emilybowden6,emilybowden6,2,0,0,"What I do want is too long to list on Twitter, but at the top of my list of priorities are climate change, policing reform, income equality, gun control, and education reform. I believe that Biden will put people in charge of these issues who align with my beliefs.",,,,1.27E+18,https://twitter.com/emilybowden6/status/1266735970973515778
5/30/20,Kbahri5,clegleiter,1,0,6,Yes to all of this ! Education Reform. #crazyPLN,,,#crazyPLN,1.27E+18,https://twitter.com/Kbahri5/status/1266734672542908416
5/30/20,j_enemokwu,,0,0,5,"So what’s the best way to seek education reform and put black history in the curriculum? Is it petitions, writing to MPs etc. Or is it an increase in pan-African schools to teach outside the curriculum ?",,,,1.27E+18,https://twitter.com/j_enemokwu/status/1266720927666094082
5/30/20,Isa30430589,,0,0,2,أول خطوة اخدتها فلندا للنهوض بالتعليم هي التخلص من الجراثيم.. هكذا يسميها الدكتور سالبرغ مؤسس حركة إصلاح النظام التعليمي الفندي.. ولقد اشتق كلمة (جرثوم GERM) واختصارها= Global Education Reform Movement,,,,1.27E+18,https://twitter.com/Isa30430589/status/1266713860200894471
5/30/20,WorldProfessor,JuliaFliss,1,1,1,#Ourstory Education reform ,,,#Ourstory,1.27E+18,https://twitter.com/WorldProfessor/status/1266709720955576320
5/30/20,SomeGuy10473152,brokeymcpoverty,1,0,0,Just sad to see this is what our for profit education system is producing. #educationreform,,,#educationreform,1.27E+18,https://twitter.com/SomeGuy10473152/status/1266703241825288192
5/30/20,C4RLCastIron,TinaButcher18,1,0,1,"It would never happen but id love to see a whole new education reform, the Uni I go to is filled with mature students all saying the same as me, that learning is easier now via wisdom and the willingness to learn, something not many 'kids' have.",,,,1.27E+18,https://twitter.com/C4RLCastIron/status/1266697776559251456
5/30/20,SassyAssiana,bIushietae,0,0,0,"This is why education reform has been a thing. You must have skipped the day that taught that we stole from the native people first. Technically the Vikings were probably superior, no one knows. You think you all do, but seriously no.",,,,1.27E+18,https://twitter.com/SassyAssiana/status/1266696777484382208
5/30/20,remnanttexan,wtwills09,0,0,0,W also negotiated Education reform with Ted Kennedy and signed a bipartisan bill. He also passed tax cuts and Medicare prescription coverage with bipartisan support. All of that before 9/11.,,,,1.27E+18,https://twitter.com/remnanttexan/status/1266696658538110977
5/30/20,soham_and,narendramodi,0,0,0,We are proud till last gen come That one PM came and changing the Manifesto of destiny with unspeakable leadership and Rules. We need you more...TILL BOUNDING GLGIT BALTISTAN POK CHINA ARTICLE 30 EDUCATION REFORM 5 TRILLION ECONOMY VOCAL PE LOCAL ATMANIRBAN BHARAT AND LOTS,,,,1.27E+18,https://twitter.com/soham_and/status/1266693499338076162
5/30/20,IqrahI,TheGhostBSL,1,0,1,"These riots haven’t been the only way black people have protested. Since before Rodney King we have been calling for police reform, education reform etc all to prevent racism from the lowest level. It is illegal to be blatantly racist in the UK and yet people still are so we-",,,,1.27E+18,https://twitter.com/IqrahI/status/1266691845704294400
5/30/20,Search_Light_in,ssudhirkumar,1,0,0,Education reform UCC POK annexation Remove the work secular from India Constitution Declare Hindu Rashtra..,,,,1.27E+18,https://twitter.com/Search_Light_in/status/1266690063066415105
5/30/20,TerriGuillReis,rattiation,0,0,1,Education reform.,,,,1.27E+18,https://twitter.com/TerriGuillReis/status/1266685294478159874
5/30/20,SahilKapoor,,1,0,0,"The last century has been an especially bad one for memory. A hundred years of progressive education reform have discredited memorization as oppressive and stultifying—not only a waste of time, but positively harmful to the developing brain.",,,,1.27E+18,https://twitter.com/SahilKapoor/status/1266659294922989573
5/30/20,farr0ckkid,christillmatic,0,0,1,"I don’t disagree with that, but I think there should be a limit to what is effective protests. Burning down businesses owned by minorities isn’t effective in the slightest. Push for prison, police, and education reform. Not mindless rioting and looting.",,,,1.27E+18,https://twitter.com/farr0ckkid/status/1266635595251679233
5/30/20,hlee83,sandrapearsall,0,0,0,We need to relearn and properly teach American history to our young. I went to a Christian school and don’t remember learning this. #educationreform #KnowYourHistory #BlackLivesMatters,,,#educationreform #KnowYourHistory #BlackLivesMatters,1.27E+18,https://twitter.com/hlee83/status/1266631709765689346
5/30/20,CynsTreat,jonst0kes,0,0,0,"Ok I feel better. We can't let anything happen to our @POTUS @realDonaldTrump. There is still too much to fix in our Country. Infrastructure, Technical Education reform, Bio-remediation, etc. #JustSayin #AmericaFirst before skin color, religion, or both Political Parties",,@POTUS @realDonaldTrump,#JustSayin #AmericaFirst,1.27E+18,https://twitter.com/CynsTreat/status/1266626732703887361
5/30/20,gatling_gun27,R24966786,0,0,38,Malala forgot that its pakistan that need education reform first not the rest of the world.,,,,1.27E+18,https://twitter.com/gatling_gun27/status/1266626610351861760
5/30/20,Williesillie2,,6,9,102,I feel like we need education reform because we live in a hell literal discord and pestilence and still the most stressed out I get is when I wake up from a nightmare where I forgot to do an assignment that’s due tomorrow,,,,1.27E+18,https://twitter.com/Williesillie2/status/1266621954858954755
5/30/20,YourePoorAsf,ERUBSSS,3,68,218,We need education reform pls ,,,,1.27E+18,https://twitter.com/YourePoorAsf/status/1266616865247420419
5/30/20,Rohits_17,MehHarshil,1,0,3,Education reform ? Constitutional reform ? Repealing the 1992 places of worship act Taking back land from the churches Freeing temples from govt control All higher education in Indian languages along with English as promised in #NEP Taking back waqf occupied land Closing MoMA,,,#NEP,1.27E+18,https://twitter.com/Rohits_17/status/1266611372793696256
5/30/20,WarShark4Eva,SFF_Writer_Dan,0,0,2,"A cop kills someone and people are like, “That’s only 1 cop out of 1000s of good cops” but anytime we talk about education reform, it’s “If we have even 1 bad or inappropriate teacher, we need to overhaul the whole system.” Why are teachers held to a higher standard than cops? ",,,,1.27E+18,https://twitter.com/WarShark4Eva/status/1266610893841813504
5/30/20,Dreamy3063,,1,0,0,"As these new groups gain power from their supporters, they begin cleaning up the issues that plague society such as poverty, systemic racism, education reform, food &amp; water, e.t.c. Capitalistic giants and monopolies that threatened to crumble during the pandemic...",,,,1.27E+18,https://twitter.com/Dreamy3063/status/1266606623809650688
5/30/20,Lovely6543210,,0,0,0,@narendramodi Govt Removing Article 370 Triple talaq bill New motor vehicle act UAPA bill CAA bill J&amp;k reservation bill Ram mandir Marvelous work done by Namo govt Yet to come #NRC #UCC #PopulationControlLaw #EducationReform #ModiBestPmEver,,@narendramodi,#NRC #UCC #PopulationControlLaw #EducationReform #ModiBestPmEver,1.27E+18,https://twitter.com/Lovely6543210/status/1266603380467621889
5/30/20,_landon_wilkins,,0,0,0,Working on a piece right now. Writing is activism. There’s space for everyone in the movement. #BeSafe #ActivistNotTerrorist #JusticeForGeorge #educationreform #TransIsBeautiful #TonyMcDade #HistoryRepeatsItself,,,#BeSafe #ActivistNotTerrorist #JusticeForGeorge #educationreform #TransIsBeautiful #TonyMcDade #HistoryRepeatsItself,1.27E+18,https://twitter.com/_landon_wilkins/status/1266590239142928391
5/30/20,BackInStorrs,,1,0,5,"Things need to change at all levels immediately. Enough BS talk from Rs and Ds, it is time for action. We need criminal justice reform, education reform - we need to end this systemic racism. Go back to your state capitol or DC and do something for the people - not corporations.",,,,1.27E+18,https://twitter.com/BackInStorrs/status/1266584785121693701
5/30/20,TeachForThePH,,1,0,0,"Our Co-Founder & CEO, Clarissa Delgado, shares her closing message. ""The first two years of your lifelong journey towards social justice and education reform ends today."" #Padayon2020",,,#Padayon2020,1.27E+18,https://twitter.com/TeachForThePH/status/1266584350037958658
5/30/20,book_souk,,0,0,0,Book - A Political Education: Black Politics and Education Reform in Chicago since the 1960s http://ow.ly/KLaz30ql3RA HT @EToddBreland @uncpressblog,,@EToddBreland @uncpressblog,,1.27E+18,https://twitter.com/book_souk/status/1266583875045724161
5/30/20,hyperpresents,mymommyspost,0,0,0,This is a result of neoliberal education reform that sucked the money out of schools. Corporations bought charter schools to enforce racist teaching omitting vital parts of history so that people would stay ignorant about their class and its ties to race.,,,,1.27E+18,https://twitter.com/hyperpresents/status/1266583787665752064
5/30/20,robtrev22,draymonster23,1,0,0,"A similar plan to that proposed by Bernie Sanders, a candidate I campaigned very hard for and would have loved to have seen win the nomination. It will take a political push from the left to focus on wealth inequality, education reform, and a labor union revival.",,,,1.27E+18,https://twitter.com/robtrev22/status/1266581353258266624
5/30/20,deadendXXI,jarpad,0,0,0,"Wow didn’t take you for the kind of guy to say “education &amp; reform” &amp; then shame blacklivesmatter as a “platitude”. Look at history &amp; “educate” yourself on how riots have gained change, not the government. Riots are the language of the people not heard.",,,,1.27E+18,https://twitter.com/deadendXXI/status/1266581224702775297
5/30/20,buffysworld67,somm_bitch,1,0,0,"Yeah, but neither political party ever seriously addresses the issues that would help here: justice / prison / education reform. They talk about it during the campaign and then forget about it.",,,,1.27E+18,https://twitter.com/buffysworld67/status/1266579895112609792
5/30/20,vikrantkumar,iKaran70,2,0,0,"What do we mena by Police reform, what action you what GOI to take? Kahin bhi sodh liya police reform bas isliye? Judicial reform govt tried, it's a long process, can't happen overnight. Education reform is old issue, not in last 1 year. What is with Aadhar data? Chidu?",,,,1.27E+18,https://twitter.com/vikrantkumar/status/1266567511211835393
5/30/20,HOFSimp,RoseGoldJammin,0,0,0,They run the school system so how in the world would we ever get education reform? Our children can only learn what they allow them to because they run the country... and we can’t educate them ourselves because we as a people sometimes act ignorantly This looks like the only way.,,,,1.27E+18,https://twitter.com/HOFSimp/status/1266560676203503618
5/30/20,HamiltonCollege,,0,0,8,"Inspired by her study abroad experience in Asia, Eliza Renn ’20 is eager to return and learn about education reform in Taiwan as recipient of Fulbright award. https://bit.ly/36Hv7Ix #studywhatyoulove #findyourfuture @FulbrightPrgrm",,@FulbrightPrgrm,#studywhatyoulove #findyourfuture,1.27E+18,https://twitter.com/HamiltonCollege/status/1266538577661485057
5/30/20,PedroIsIgnorant,rawwalker_,0,0,0,About to be Working with ucpd to implement police education reform meeting being scheduled as i tweet ,,,,1.27E+18,https://twitter.com/PedroIsIgnorant/status/1266534672093179904
5/30/20,OrgnlYangster,bengarvin,1,2,15,"Hell yeah! We need MAJOR education reform teaching ALL the history of America and ALL the cultures that make up America. America isnt white, black, or brown. Its not a solid color. Its red white and blue and we NEED 2 learn about our accomplishments and from our embarrassments",,,,1.27E+18,https://twitter.com/OrgnlYangster/status/1266531830427238400
5/30/20,LaurenLeCo,rat_thrower,0,0,1,The schools don’t suck because of “lack of funding”. You can’t continue to throw money at a system that’s broken. Education reform is what needs to happen.,,,,1.27E+18,https://twitter.com/LaurenLeCo/status/1266524297406951430
5/29/20,Cody_Willi,T_shep7,0,0,1,Education reform,,,,1.27E+18,https://twitter.com/Cody_Willi/status/1266514923569516550
5/29/20,MindsThirsty,,0,1,1,Looking for those who would interested in teaching a mini virtual summer camp! #education #edtech #elearning #edutech #educationreform Dm me for more details.,,,#education #edtech #elearning #edutech #educationreform,1.27E+18,https://twitter.com/MindsThirsty/status/1266503311802298368
5/29/20,luismen1991,,1,0,2,"Great time for @realDonaldTrump to write the rules on police disorderly conduct after all this. Mandatory body cams, more training, diverse police forces that accurately represent neighborhoods, community outreach, but more importantly hope. Jobs, education reform &amp; prison reform",,@realDonaldTrump,,1.27E+18,https://twitter.com/luismen1991/status/1266502517388705797
5/29/20,SoorajM13727926,,0,0,2,"If you want to make India India, then Police Reform Legal Reform Election Reform Education Reform Industrial Reform Agricultural Reform Democratic Reform Judicial Reform Administrative Reform and Constitutional Reform P @PMOIndia @narendramodi @AmitShah @JPNadda",,@PMOIndia @narendramodi @AmitShah @JPNadda,,1.27E+18,https://twitter.com/SoorajM13727926/status/1266499183667810304
5/29/20,BlerdyChan,unclejonsaid,1,0,1,But he did do it outside. He was paying protestors bails AND advocating for prison and education reform.,,,,1.27E+18,https://twitter.com/BlerdyChan/status/1266495175414681600
5/29/20,Andreafowler66,jarpad,0,0,1,"Jared, you are such a wonderful soul, kind and compassionate, and you are absolutely right we ALL need to be more compassionate and aware. The key to change is education, reform, working together to create change. We need to look beyond skin color. We are created equal.",,,,1.27E+18,https://twitter.com/Andreafowler66/status/1266494799617634312
5/29/20,CDN_Dimension,,0,2,2,"The ideological approach to education reform promoted by Betsy DeVos &amp; Ted Cruz echoes Manitoba’s creation of a commission in 2019 to cut back K-12 funding, school boards, trustees, &amp; education property taxes. #mbpoli",,,#mbpoli,1.27E+18,https://twitter.com/CDN_Dimension/status/1266493268776239104
5/29/20,luismen1991,PeevishPrimate,0,0,1,Lol it’s not that simple. I’ve addressed solutions before. Job creation. Education reform. Infrastructure plan. Mentorships. Media and social media regulation. Academia mandated to offer bipartisan opinions equally.,,,,1.27E+18,https://twitter.com/luismen1991/status/1266492195256893440
5/29/20,cvaldary,julian9r9r,0,0,1,"If you’re looking for someone to promote education reform and spiritual edification, I’m one of those people.",,,,1.27E+18,https://twitter.com/cvaldary/status/1266487712422547466
5/29/20,educationreform,Tuakachyc,0,0,0,,,,,1.27E+18,https://twitter.com/educationreform/status/1266487330342305799
5/29/20,LeftistMehdi,,0,0,0,Community policing starts with community members being the police force Start with preventing cops from living outside the city they patrol in Hire from the community Hire more minorities Require diversity training Require college education Reform the meaning of police work,,,,1.27E+18,https://twitter.com/LeftistMehdi/status/1266487109164183553
5/29/20,educationreform,alexsimoneex,0,0,0,It might just have to be a stand alone course! #Minneapolis #BlackLivesMatter #minneapolisriots,,,#Minneapolis #BlackLivesMatter #BlackLivesMatter #minneapolisriots,1.27E+18,https://twitter.com/educationreform/status/1266486964469018624
5/29/20,brandon_yockel,,0,0,0,"We need education reform to seriously discuss the US Constitution and the costs and sacrifices required for liberty. It isn’t the right to do as one pleases (anarchy). It’s assured freedom from oppression. A constant unseating if power. Accept it, even if it’s us. #Constitution",,,#Constitution,1.27E+18,https://twitter.com/brandon_yockel/status/1266483103532490754
5/29/20,MegShepks,GovLauraKelly,0,0,1,"Kansas needs to expand Medicaid, revise sentencing structure, continue education reform, pass legislation that supports survivors of sexual assault and IPV and implement programs to provide support to all marginalized populations. This is how I’m an aspiring ally in my state. ",,,,1.27E+18,https://twitter.com/MegShepks/status/1266482250583019520
5/29/20,Netherveil,D_Bbach,1,0,1,This whole hilarious post just shows why we need education reform,,,,1.27E+18,https://twitter.com/Netherveil/status/1266481133652328449
5/29/20,T_shep7,,1,0,0,As we push for police reform can we also push just as hard for education reform? WE ALL NEED BOTH,,,,1.27E+18,https://twitter.com/T_shep7/status/1266477010764865536
5/29/20,a_m_e_s_s,NyeshaNaynay,0,0,0,"It is all in education. But there is a theory that I wrote a thesis on in my multiculturalism and democracy class on the ""bubble"" of home life and smaller towns even if education reform which is the first step there is still the layer of accepting and understanding the narrative",,,,1.27E+18,https://twitter.com/a_m_e_s_s/status/1266476570212007944
5/29/20,NyeshaNaynay,a_m_e_s_s,1,1,2,IVE BEEN SCREAMING EDUCATION REFORM SO HARD. This is the real reason why I’m bald.,,,,1.27E+18,https://twitter.com/NyeshaNaynay/status/1266475856563703822
5/29/20,whoisnicko,,0,0,0,"@profgalloway Amazing entry on No Mercy/No Malice! It's the moment for education disruption, big time! I sent you a humble 7 page email rant, would love your brilliance to review a proposal. #educationreform #Moonshot",,@profgalloway,#educationreform #Moonshot,1.27E+18,https://twitter.com/whoisnicko/status/1266464122629218306
5/29/20,KingKixcks,,0,0,0,Police Reform Criminal Justice Reform Education Reform The country needs to address these problems but nobody wants too because by doing so you change of the scheme of power in the country,,,,1.27E+18,https://twitter.com/KingKixcks/status/1266456582944063488
5/29/20,SoulaParassidis,,0,1,3,Our third masterclass underscored my burden for #education #reform - none of my attendees feel prepared for a career even with advanced degrees! This has to stop! #HigherEducation,,,#education #reform #HigherEducation,1.27E+18,https://twitter.com/SoulaParassidis/status/1266447157323640833
5/29/20,BWEPodcast,,0,0,0,"Our second episode is live. Check out Ify Walker and our dynamic discussion on salary equity, hiring norms, and disrupting bias in the education reform sector. #BWEP #blackworkexperience #BlackWorkExperiencePodcast #podcast #podcastlife #BlackPodcasts #BlackPodcasters #Equity",,,#BWEP #blackworkexperience #BlackWorkExperiencePodcast #podcast #podcastlife #BlackPodcasts #BlackPodcasters #Equity,1.27E+18,https://twitter.com/BWEPodcast/status/1266446725834825728
5/29/20,Ronin1_Q,LarsLarsonShow,0,0,3,Lars my name is Nick Faris and I have not gone public with my campaign yet it will start in a few months but I am running for governor of the state of Oregon. One of the major platforms I’m running on is the education reform in the state of Oregon. We will make education better! ,,,,1.27E+18,https://twitter.com/Ronin1_Q/status/1266446444371689473
5/29/20,FluentFilm,RealDavidRush,0,4,6,It will take generations of highly motivated resisters to continue crushing the GOP. We’ll need to continue to take control of Congress and state houses. Rid the judiciary of the garbage that’s been dumped on it. Investments in education. Reform justice. Lots of hard work to do.,,,,1.27E+18,https://twitter.com/FluentFilm/status/1266442496122466305
5/29/20,HardLuckHero,,0,0,0,"#BlackLivesMatter And I know, as a brown man, that nothing gets better for us until it gets better for them. We need law-enforcement reform (police, border patrol, etc.). We need education reform. We need gun reform. We need fucking CHANGE! ...We're past the boiling point.",,,#BlackLivesMatter #BlackLivesMatter,1.27E+18,https://twitter.com/HardLuckHero/status/1266438108238639104
5/29/20,HeadCaseGlobal,,0,0,0,Revolutions often come from rank outsiders. Crazy or not https://headcase.global/scientific-and-cultural-revolution/ ideas worth thinking about @indy_johar @HiddenBrain @RonanHarrington @Lightkeeper #perspectiva #revolutionaryscience #educationreform #PeoplePower #RevolutionNothingLess,,@indy_johar @HiddenBrain @RonanHarrington @Lightkeeper,#perspectiva #revolutionaryscience #educationreform #PeoplePower #RevolutionNothingLess,1.27E+18,https://twitter.com/HeadCaseGlobal/status/1266434086719172609
5/29/20,JmsGdsn,,1,0,0,"And this will all continue to happen if we continue to fail to address the real systemic issues facing our country today. Police reform, changes in leadership, political corruption and fear mongerjng, gun reform, infrastructure and education reform…",,,,1.27E+18,https://twitter.com/JmsGdsn/status/1266433495670366208
5/29/20,lycalya,alansuparlan,1,0,2,"mail is me to inclusive institutions, corruption eradication, and education reform: ",,,,1.27E+18,https://twitter.com/lycalya/status/1266427500193656832
5/29/20,luismen1991,,1,0,5,I told y’all what America needs to solve racial division. Poverty removal. High paying jobs do that best. Education reform does that best. Infrastructure plans do that best. America needs a rural and urban revitalization plan. Oh and stopping division in media &amp; acadmia.,,,,1.27E+18,https://twitter.com/luismen1991/status/1266425636937183234
5/29/20,QuestMalloy,,0,0,1,"yo, @JoeBiden, good speech. Add reparations and education reform to the platform.",,@JoeBiden,,1.27E+18,https://twitter.com/QuestMalloy/status/1266424343560482816
5/29/20,luismen1991,DariusFls,1,0,1,People need jobs. We need education reform so people can get jobs. We need cultural reform do drug and violence from hip hop culture don’t control the minds of the youth. That’s it.,,,,1.27E+18,https://twitter.com/luismen1991/status/1266421931328356360
5/29/20,kombiz,PaulBlu,0,0,0,"they are the premiere education ""reform"" group - making sure that cops get their money before schools.",,,,1.27E+18,https://twitter.com/kombiz/status/1266420523602452495
5/29/20,luismen1991,,0,0,3,"Only then can you ask further questions and actually come up with effective solutions. Like idk, culture reform, but more realistically job growth in poor neighborhoods, education reform, more neighborhood policing, using local figures for crime prevention. That sort of thing.",,,,1.27E+18,https://twitter.com/luismen1991/status/1266410441854595077
5/29/20,xianb8,,1,1,3,"Organizations like Stand for Children or ""Democrats"" for Education Reform literally have poured millions of dollars into races to oppose candidates advocating for communities of color and the will of thousands educators of color.",,,,1.27E+18,https://twitter.com/xianb8/status/1266410131761377282
5/29/20,whatMsKsaid,,0,2,3,from @Janaan__Ahmed and Students for Education Reform (Our Turn) #ourturn2020 ,,@Janaan__Ahmed,#ourturn2020,1.27E+18,https://twitter.com/whatMsKsaid/status/1266409501332291587
5/29/20,billypisanoy,,0,0,0,"Support the Higher Education Reform and Opportunity Act, H.R. 4098 and S. 2339. https://www.freedomworks.org/content/support-higher-education-reform-and-opportunity-act-hr-4098-and-s-2339?utm_campaign=meetedgar&amp;utm_medium=social&amp;utm_source=meetedgar.com",,,,1.27E+18,https://twitter.com/billypisanoy/status/1266406519714832385
5/29/20,a_m_e_s_s,,2,1,3,"Education reform in this country IS a human rights issue and must be a priority on any progressive, socialist, radical leftist candidates list. No longer should exposure to factual information be censored by governments or accsess to factual education be determined by taxes",,,,1.27E+18,https://twitter.com/a_m_e_s_s/status/1266404650942631937
